title,description,date,time,city,theme,level,buttonLink,estado
Dão: o melhor dos vinhos,Com Pedro Mendonça,12 julho,18:00 - 19:30,Porto,Vinhos,Iniciante,#,Publicado
Queijo flamengo não é um queijo,Com Edgardo Santos,16 julho,18:00 - 19:30,Lisboa,Queijos,Intermédio,#,Publicado
Queijo de cabra para amantes,Com Rodrigo Julião,04 agosto,18:00 - 19:30,Lisboa,Queijos,Intermédio,#,Publicado
Doces: o melhor dos melhores,Com Patrícia Lima,18 agosto,18:00 - 19:30,Lisboa,Doçaria,Iniciante,#,Publicado
O azeite galo cacareja,Com Tânia Rodrigues,23 agosto,18:00 - 19:00,Porto,Azeite,Iniciante,#,Publicado
Vinho branco não é para meninos,Com João Leitão,03 setembro,18:00 - 19:00,Lisboa,Vinhos,Intermédio,#,Publicado